{
  "schema_version": "2.0",
  "project": {
    "id": "demo-reading",
    "name": "Reading Notes — synthetic example",
    "language": "en",
    "revision": 1,
    "updated_at": "2026-10-28",
    "original_idea": "I want to find my reading notes quickly."
  },
  "brief": {
    "problem": "Notes are scattered across notebooks.",
    "audience": "One reader, using their own laptop.",
    "outcome": "Find and reopen a note by title.",
    "mvp": [
      "Create a note",
      "Search titles",
      "Export notes"
    ],
    "out_of_scope": [
      "Accounts",
      "Cloud sync",
      "Recommendations"
    ],
    "constraints": [
      "Synthetic demonstration; no implementation requested."
    ]
  },
  "facts": [
    {
      "id": "F-01",
      "text": "Single-user laptop workflow.",
      "status": "provided",
      "source": "Synthetic scenario author"
    }
  ],
  "references": [
    {
      "id": "S-01",
      "locator": "Synthetic text reference",
      "observation": "Title, text area and search list.",
      "status": "observed",
      "rights": "Original synthetic content, MIT",
      "sensitivity": "public"
    }
  ],
  "predesign": {
    "kind": "visual",
    "description": "Proposed quiet two-column layout; stacked list and editor on narrow screens; visible keyboard focus.",
    "status": "proposed"
  },
  "journeys": [
    {
      "id": "J-01",
      "steps": [
        "Create note",
        "Enter title and text",
        "Save",
        "Search title",
        "Open result"
      ],
      "failures": [
        "Empty title: keep input and show error",
        "No results: show clear empty state"
      ]
    }
  ],
  "requirements": [
    {
      "id": "R-01",
      "description": "Search saved note titles.",
      "priority": "must",
      "acceptance": [
        "A matching title appears in results.",
        "No match shows an empty state without deleting notes."
      ],
      "verification": "Planned domain and keyboard journey tests."
    }
  ],
  "technical": {
    "architecture": "Proposed local-first single-user tool; inspect repository before choosing technology.",
    "data": "Note: id, title, body, updated_at; local owner; deletion and export behavior to settle.",
    "api": "No remote API proposed.",
    "security": "No credentials or external providers; local device access remains a host concern.",
    "operations": "Proposed JSON export/import backup; restoration still to specify."
  },
  "decisions": [
    {
      "id": "D-01",
      "text": "Exclude cloud synchronization from MVP.",
      "reason": "Keep first outcome small.",
      "status": "confirmed",
      "source": "Synthetic scenario decision; no real human approval.",
      "evidence": "Synthetic fixture only; not an approval in a trusted conversation.",
      "affects": [
        "R-01"
      ]
    }
  ],
  "questions": [
    {
      "id": "Q-01",
      "text": "What should happen if saving fails?",
      "blocking": true,
      "resolution": ""
    }
  ],
  "reviews": [],
  "authorization": {
    "state": "not_granted",
    "scope": "Planning only",
    "evidence": "Synthetic example; no authorization."
  },
  "validation": [
    {
      "requirement_ids": [
        "R-01"
      ],
      "status": "planned",
      "environment": "Not executed",
      "evidence": "This is a planning fixture, not tested software."
    }
  ],
  "next_action": "Propose save/recovery behavior and review the direction."
}
